{
  "protocolVersion": "0.4",
  "id": "lease_fixture",
  "ownerId": "owner_fixture",
  "executionRequestId": "execution_request_fixture",
  "attemptId": "attempt_fixture",
  "holder": {
    "category": "execution_environment",
    "id": "environment_fixture",
    "version": "1.0.0",
    "environmentKind": "local",
    "manifest": {
      "id": "manifest_fixture",
      "version": "1.0.0",
      "digest": "sha256:f16d05ec6b29248d2c61adb1e9263f78e4f7bace1b955014a2d17872cfe4064d"
    }
  },
  "fencingGeneration": 1,
  "cancellationGeneration": 1,
  "acquiredAt": "2026-08-13T12:00:01.000Z",
  "expiresAt": "2026-08-13T12:10:01.000Z"
}
